{
  "architectures": [
    "arm64",
    "arm64e"
  ],
  "compatibility_version": "2.3.0",
  "current_version": "2.3.0",
  "exported_symbols": {
    "arm64": [
      "_OBJC_CLASS_$_HKSubstitutor",
      "_OBJC_METACLASS_$_HKSubstitutor"
    ],
    "arm64e": [
      "_OBJC_CLASS_$_HKSubstitutor",
      "_OBJC_METACLASS_$_HKSubstitutor"
    ]
  },
  "extractor_version": "0.2.0",
  "generated_at": "2026-08-21T07:02:13Z",
  "header_checksums": {
    "Headers/HookKit.h": "834c389c67674dccea3cf669b16227f75bbcead5596a87f2c1535499ab0d0e67"
  },
  "install_name": "@rpath/HookKit.framework/HookKit",
  "objc": {
    "classes": [
      {
        "class_methods": [
          {
            "selector": "defaultBackend",
            "type_encoding": {
              "arm64": "@16@0:8",
              "arm64e": "@16@0:8"
            }
          },
          {
            "selector": "defaultSubstitutor",
            "type_encoding": {
              "arm64": "@16@0:8",
              "arm64e": "@16@0:8"
            }
          },
          {
            "selector": "getAvailableCategories",
            "type_encoding": {
              "arm64": "i16@0:8",
              "arm64e": "i16@0:8"
            }
          },
          {
            "selector": "getAvailableSubstitutorTypes",
            "type_encoding": {
              "arm64": "i16@0:8",
              "arm64e": "i16@0:8"
            }
          },
          {
            "selector": "getSubstitutorTypeInfo:",
            "type_encoding": {
              "arm64": "@20@0:8i16",
              "arm64e": "@20@0:8i16"
            }
          },
          {
            "selector": "substitutorWithAutoCoverCategories:",
            "type_encoding": {
              "arm64": "@24@0:8@16",
              "arm64e": "@24@0:8@16"
            }
          },
          {
            "selector": "substitutorWithCategory:",
            "type_encoding": {
              "arm64": "@20@0:8i16",
              "arm64e": "@20@0:8i16"
            }
          },
          {
            "selector": "substitutorWithOrderedCategories:",
            "type_encoding": {
              "arm64": "@24@0:8@16",
              "arm64e": "@24@0:8@16"
            }
          },
          {
            "selector": "substitutorWithOrderedTypes:",
            "type_encoding": {
              "arm64": "@24@0:8@16",
              "arm64e": "@24@0:8@16"
            }
          },
          {
            "selector": "substitutorWithTypes:",
            "type_encoding": {
              "arm64": "@20@0:8i16",
              "arm64e": "@20@0:8i16"
            }
          }
        ],
        "instance_methods": [
          {
            "selector": ".cxx_destruct",
            "type_encoding": {
              "arm64": "v16@0:8",
              "arm64e": "v16@0:8"
            }
          },
          {
            "selector": "activeStrategy",
            "type_encoding": {
              "arm64": "Q16@0:8",
              "arm64e": "Q16@0:8"
            }
          },
          {
            "selector": "activeType",
            "type_encoding": {
              "arm64": "i16@0:8",
              "arm64e": "i16@0:8"
            }
          },
          {
            "selector": "backendHasNativeBatch:",
            "type_encoding": {
              "arm64": "B24@0:8@16",
              "arm64e": "B24@0:8@16"
            }
          },
          {
            "selector": "backendType",
            "type_encoding": {
              "arm64": "i16@0:8",
              "arm64e": "i16@0:8"
            }
          },
          {
            "selector": "batching",
            "type_encoding": {
              "arm64": "B16@0:8",
              "arm64e": "B16@0:8"
            }
          },
          {
            "selector": "closeImage:",
            "type_encoding": {
              "arm64": "v24@0:8^{HKImage=Ii^v}16",
              "arm64e": "v24@0:8^{HKImage=Ii^v}16"
            }
          },
          {
            "selector": "enqueueKind:status:build:",
            "type_encoding": {
              "arm64": "B36@0:8i16^i20@?28",
              "arm64e": "B36@0:8i16^i20@?28"
            }
          },
          {
            "selector": "executeHooks",
            "type_encoding": {
              "arm64": "i16@0:8",
              "arm64e": "i16@0:8"
            }
          },
          {
            "selector": "executeOperation:onBackend:",
            "type_encoding": {
              "arm64": "i32@0:8@16@24",
              "arm64e": "i32@0:8@16@24"
            }
          },
          {
            "selector": "findSymbolInImage:symbolName:",
            "type_encoding": {
              "arm64": "^v32@0:8^{HKImage=Ii^v}16@24",
              "arm64e": "^v32@0:8^{HKImage=Ii^v}16@24"
            }
          },
          {
            "selector": "findSymbolsInImage:symbolNames:outSymbols:",
            "type_encoding": {
              "arm64": "i40@0:8^{HKImage=Ii^v}16@24^@32",
              "arm64e": "i40@0:8^{HKImage=Ii^v}16@24^@32"
            }
          },
          {
            "selector": "getLibErrno:",
            "type_encoding": {
              "arm64": "i24@0:8^i16",
              "arm64e": "i24@0:8^i16"
            }
          },
          {
            "selector": "hk_backendForAutoCoverFunction:replacement:requestOriginal:technique:",
            "type_encoding": {
              "arm64": "@44@0:8^v16^v24B32^C36",
              "arm64e": "@44@0:8^v16^v24B32^C36"
            }
          },
          {
            "selector": "hookFunction:withReplacement:outOldPtr:",
            "type_encoding": {
              "arm64": "i40@0:8^v16^v24^^v32",
              "arm64e": "i40@0:8^v16^v24^^v32"
            }
          },
          {
            "selector": "hookMemory:withData:size:",
            "type_encoding": {
              "arm64": "i40@0:8^v16r^v24Q32",
              "arm64e": "i40@0:8^v16r^v24Q32"
            }
          },
          {
            "selector": "hookMessageInClass:withSelector:withReplacement:outOldPtr:",
            "type_encoding": {
              "arm64": "i48@0:8#16:24^v32^^v40",
              "arm64e": "i48@0:8#16:24^v32^^v40"
            }
          },
          {
            "selector": "hookSwiftMethodInClass:withName:withReplacement:outOldPtr:",
            "type_encoding": {
              "arm64": "i48@0:8#16@24^v32^^v40",
              "arm64e": "i48@0:8#16@24^v32^^v40"
            }
          },
          {
            "selector": "hookSwiftVtableSlotInClass:withIndex:withReplacement:outOldPtr:",
            "type_encoding": {
              "arm64": "i48@0:8#16Q24^v32^^v40",
              "arm64e": "i48@0:8#16Q24^v32^^v40"
            }
          },
          {
            "selector": "init",
            "type_encoding": {
              "arm64": "@16@0:8",
              "arm64e": "@16@0:8"
            }
          },
          {
            "selector": "initLibraries",
            "type_encoding": {
              "arm64": "v16@0:8",
              "arm64e": "v16@0:8"
            }
          },
          {
            "selector": "noteHookResult:",
            "type_encoding": {
              "arm64": "v20@0:8i16",
              "arm64e": "v20@0:8i16"
            }
          },
          {
            "selector": "noteHookResult:fromBackend:",
            "type_encoding": {
              "arm64": "v28@0:8i16@20",
              "arm64e": "v28@0:8i16@20"
            }
          },
          {
            "selector": "openImage:",
            "type_encoding": {
              "arm64": "^{HKImage=Ii^v}24@0:8@16",
              "arm64e": "^{HKImage=Ii^v}24@0:8@16"
            }
          },
          {
            "selector": "resolvedTechniqueForBackend:",
            "type_encoding": {
              "arm64": "C24@0:8@16",
              "arm64e": "C24@0:8@16"
            }
          },
          {
            "selector": "setBatching:",
            "type_encoding": {
              "arm64": "v20@0:8B16",
              "arm64e": "v20@0:8B16"
            }
          },
          {
            "selector": "setTypes:",
            "type_encoding": {
              "arm64": "v20@0:8i16",
              "arm64e": "v20@0:8i16"
            }
          },
          {
            "selector": "typeForBackend:",
            "type_encoding": {
              "arm64": "i24@0:8@16",
              "arm64e": "i24@0:8@16"
            }
          },
          {
            "selector": "types",
            "type_encoding": {
              "arm64": "i16@0:8",
              "arm64e": "i16@0:8"
            }
          }
        ],
        "name": "HKSubstitutor",
        "properties": [
          {
            "getter_encoding": "Q16@0:8",
            "name": "activeStrategy"
          },
          {
            "getter_encoding": "i16@0:8",
            "name": "activeType"
          },
          {
            "getter_encoding": "B16@0:8",
            "name": "batching",
            "setter_encoding": "v20@0:8B16"
          },
          {
            "getter_encoding": "i16@0:8",
            "name": "types",
            "setter_encoding": "v20@0:8i16"
          }
        ]
      }
    ]
  },
  "tag": "v2.3.0"
}
